{
  "$schema": "https://json-schema.org/draft/2020-12/schema",
  "title": "sprachapp offline editorial create v2",
  "type": "object",
  "required": [
    "format",
    "format_version",
    "operation_id",
    "version",
    "source_sha256",
    "registry_sha256",
    "reviewer",
    "add",
    "reviews"
  ],
  "additionalProperties": false,
  "properties": {
    "format": {
      "const": "sprachapp.editorial-content"
    },
    "format_version": {
      "const": 2
    },
    "operation_id": {
      "type": "string",
      "minLength": 1
    },
    "version": {
      "type": "string",
      "minLength": 1
    },
    "reviewer": {
      "type": "string",
      "minLength": 1
    },
    "source_sha256": {
      "type": "string",
      "pattern": "^[0-9a-f]{64}$"
    },
    "registry_sha256": {
      "type": "string",
      "pattern": "^[0-9a-f]{64}$"
    },
    "add": {
      "type": "object",
      "additionalProperties": false,
      "properties": {
        "lemmas": {
          "type": "array",
          "items": {
            "type": "object",
            "required": [
              "ref",
              "lemma",
              "pos"
            ],
            "properties": {
              "ref": {
                "type": "string",
                "minLength": 1
              },
              "lemma": {
                "type": "string",
                "minLength": 1
              },
              "pos": {
                "type": "string",
                "minLength": 1
              }
            }
          }
        },
        "senses": {
          "type": "array",
          "items": {
            "type": "object",
            "required": [
              "ref",
              "lemma",
              "sense_key",
              "gloss_de",
              "definition_de"
            ],
            "properties": {
              "ref": {
                "type": "string",
                "minLength": 1
              },
              "lemma": {
                "type": "string",
                "minLength": 1
              },
              "sense_key": {
                "type": "string",
                "minLength": 1
              },
              "gloss_de": {
                "type": "string",
                "minLength": 1
              },
              "definition_de": {
                "type": "string",
                "minLength": 1
              }
            }
          }
        },
        "cards": {
          "type": "array",
          "items": {
            "type": "object",
            "required": [
              "ref",
              "form",
              "sense",
              "translation_de",
              "form_kind",
              "form_label_de",
              "cefr_band"
            ],
            "properties": {
              "ref": {
                "type": "string",
                "minLength": 1
              },
              "form": {
                "type": "string",
                "minLength": 1
              },
              "sense": {
                "type": "string",
                "minLength": 1
              },
              "translation_de": {
                "type": "string",
                "minLength": 1
              },
              "form_kind": {
                "type": "string",
                "minLength": 1
              },
              "form_label_de": {
                "type": "string",
                "minLength": 1
              },
              "cefr_band": {
                "type": "string",
                "minLength": 1
              },
              "learning": {
                "type": "object",
                "description": "Required for every new card when the source pack uses schema 3. Group heads must resolve in the resulting pack. Schema 2 remains supported.",
                "additionalProperties": false,
                "required": [
                  "group_id",
                  "primary_card_id",
                  "topic",
                  "related",
                  "note"
                ],
                "properties": {
                  "group_id": {
                    "type": "string",
                    "minLength": 1
                  },
                  "primary_card_id": {
                    "type": "string",
                    "minLength": 1
                  },
                  "topic": {
                    "type": "string",
                    "minLength": 1
                  },
                  "note": {
                    "type": "string",
                    "minLength": 1
                  },
                  "related": {
                    "type": "array",
                    "uniqueItems": true,
                    "items": {
                      "type": "string",
                      "minLength": 1
                    }
                  }
                }
              }
            }
          }
        },
        "decks": {
          "type": "array",
          "items": {
            "type": "object",
            "required": [
              "ref",
              "slug",
              "title_de"
            ],
            "properties": {
              "ref": {
                "type": "string",
                "minLength": 1
              },
              "slug": {
                "type": "string",
                "minLength": 1
              },
              "title_de": {
                "type": "string",
                "minLength": 1
              }
            }
          }
        },
        "deck_cards": {
          "type": "array",
          "items": {
            "type": "object",
            "required": [
              "deck",
              "card",
              "position"
            ],
            "properties": {
              "deck": {
                "type": "string",
                "minLength": 1
              },
              "card": {
                "type": "string",
                "minLength": 1
              },
              "position": {
                "type": "integer",
                "minimum": 1
              }
            }
          }
        },
        "deck_words": {
          "type": "array",
          "items": {
            "type": "object",
            "required": [
              "form_norm",
              "deck",
              "primary_card",
              "position"
            ],
            "properties": {
              "form_norm": {
                "type": "string",
                "minLength": 1
              },
              "deck": {
                "type": "string",
                "minLength": 1
              },
              "primary_card": {
                "type": "string",
                "minLength": 1
              },
              "position": {
                "type": "integer",
                "minimum": 1
              }
            }
          }
        },
        "sentences": {
          "type": "array",
          "items": {
            "type": "object",
            "required": [
              "ref",
              "text",
              "translation_de"
            ],
            "properties": {
              "ref": {
                "type": "string",
                "minLength": 1
              },
              "text": {
                "type": "string",
                "minLength": 1
              },
              "translation_de": {
                "type": "string",
                "minLength": 1
              }
            }
          }
        },
        "card_sentences": {
          "type": "array",
          "items": {
            "type": "object",
            "required": [
              "card",
              "sentence",
              "position",
              "gap_start",
              "gap_end",
              "accepted",
              "valid_alternatives"
            ],
            "properties": {
              "card": {
                "type": "string",
                "minLength": 1
              },
              "sentence": {
                "type": "string",
                "minLength": 1
              },
              "position": {
                "const": 1
              },
              "gap_start": {
                "type": "integer",
                "minimum": 0
              },
              "gap_end": {
                "type": "integer",
                "minimum": 1
              },
              "accepted": {
                "type": "array",
                "minItems": 1,
                "maxItems": 1,
                "items": {
                  "type": "string",
                  "minLength": 1
                }
              },
              "valid_alternatives": {
                "type": "array",
                "uniqueItems": true,
                "items": {
                  "type": "string",
                  "minLength": 1
                }
              }
            }
          }
        },
        "sentence_tokens": {
          "type": "array",
          "items": {
            "type": "object",
            "required": [
              "sentence",
              "idx",
              "surface",
              "start_pos",
              "end_pos"
            ],
            "properties": {
              "sentence": {
                "type": "string",
                "minLength": 1
              },
              "idx": {
                "type": "integer",
                "minimum": 0
              },
              "surface": {
                "type": "string",
                "minLength": 1
              },
              "start_pos": {
                "type": "integer",
                "minimum": 0
              },
              "end_pos": {
                "type": "integer",
                "minimum": 1
              }
            }
          }
        },
        "dictionary_forms": {
          "type": "array",
          "items": {
            "type": "object",
            "required": [
              "form",
              "sense",
              "gloss_de",
              "rank"
            ],
            "properties": {
              "form": {
                "type": "string",
                "minLength": 1
              },
              "sense": {
                "type": "string",
                "minLength": 1
              },
              "gloss_de": {
                "type": "string",
                "minLength": 1
              },
              "rank": {
                "type": "integer",
                "minimum": 1
              }
            }
          }
        },
        "stories": {
          "type": "array",
          "items": {
            "type": "object",
            "required": [
              "ref",
              "slug",
              "title",
              "kind",
              "cefr_band",
              "minutes"
            ],
            "properties": {
              "ref": {
                "type": "string",
                "minLength": 1
              },
              "slug": {
                "type": "string",
                "minLength": 1
              },
              "title": {
                "type": "string",
                "minLength": 1
              },
              "kind": {
                "type": "string",
                "minLength": 1
              },
              "cefr_band": {
                "type": "string",
                "minLength": 1
              },
              "minutes": {
                "type": "integer",
                "minimum": 1
              }
            }
          }
        },
        "story_sentences": {
          "type": "array",
          "items": {
            "type": "object",
            "required": [
              "story",
              "sentence",
              "idx",
              "paragraph_idx"
            ],
            "properties": {
              "story": {
                "type": "string",
                "minLength": 1
              },
              "sentence": {
                "type": "string",
                "minLength": 1
              },
              "idx": {
                "type": "integer",
                "minimum": 0
              },
              "paragraph_idx": {
                "type": "integer",
                "minimum": 0
              }
            }
          }
        },
        "word_aliases": {
          "type": "array",
          "items": {
            "type": "object",
            "required": [
              "form_norm",
              "word"
            ],
            "properties": {
              "form_norm": {
                "type": "string",
                "minLength": 1
              },
              "word": {
                "type": "string",
                "minLength": 1
              }
            }
          }
        }
      }
    },
    "reviews": {
      "type": "array",
      "items": {
        "type": "object",
        "required": [
          "sentence",
          "decision",
          "reason",
          "checked",
          "alternatives_checked"
        ],
        "properties": {
          "sentence": {
            "type": "string"
          },
          "decision": {
            "const": "approved"
          },
          "reason": {
            "type": "string",
            "minLength": 1
          },
          "checked": {
            "type": "object",
            "required": [
              "text",
              "translation_de",
              "tokens_sha256",
              "links_sha256"
            ]
          },
          "alternatives_checked": {
            "type": "array"
          },
          "learning_contexts": {
            "type": "array",
            "items": {
              "type": "object",
              "required": [
                "token_index",
                "surface",
                "sense",
                "approved",
                "reason"
              ],
              "properties": {
                "token_index": {
                  "type": "integer",
                  "minimum": 0
                },
                "surface": {
                  "type": "string",
                  "minLength": 1
                },
                "sense": {
                  "type": "string",
                  "minLength": 1
                },
                "approved": {
                  "const": true
                },
                "reason": {
                  "type": "string",
                  "minLength": 1
                }
              }
            }
          }
        }
      }
    }
  }
}
